python/int8_caffe_mnist/log/log.txt
[TensorRT] VERBOSE: *************** Autotuning format combination: Float(1,28,784,784) -> Float(1,24,576,11520) ***************
[TensorRT] VERBOSE: --------------- Timing Runner: conv1 (LegacySASSConvolution)
[TensorRT] VERBOSE: LegacySASSConvolution has no valid tactics for this config, skipping
[TensorRT] VERBOSE: --------------- Timing Runner: conv1 (CaskConvolution)
[TensorRT] VERBOSE: conv1 (scudnn) Set Tactic Name: volta_scudnn_128x128_relu_interior_nn_v1
[TensorRT] VERBOSE: Tactic: 1754569683116234317 time 0.253952
[TensorRT] VERBOSE: conv1 (scudnn) Set Tactic Name: volta_scudnn_128x128_relu_medium_nn_v1
[TensorRT] VERBOSE: Tactic: 1825138533642645384 time 0.262816
[TensorRT] VERBOSE: conv1 (scudnn) Set Tactic Name: volta_scudnn_128x32_relu_interior_nn_v1
[TensorRT] VERBOSE: Tactic: 2733356012094739613 time 0.07952
[TensorRT] VERBOSE: conv1 (scudnn) Set Tactic Name: volta_scudnn_128x64_relu_xregs_large_nn_v1
[TensorRT] VERBOSE: Tactic: 2842488832350522458 time 0.149344
[TensorRT] VERBOSE: conv1 (scudnn) Set Tactic Name: volta_scudnn_128x128_relu_small_nn_v1
[TensorRT] VERBOSE: Tactic: 3915320020053085238 time 0.265024
[TensorRT] VERBOSE: conv1 (scudnn) Set Tactic Name: volta_scudnn_128x128_relu_xregs_large_nn_v1
[TensorRT] VERBOSE: Tactic: 6448355332020552203 time 0.370336
[TensorRT] VERBOSE: conv1 (scudnn) Set Tactic Name: volta_scudnn_128x64_relu_small_nn_v1
[TensorRT] VERBOSE: Tactic: 6808617066150061604 time 0.134144
[TensorRT] VERBOSE: conv1 (scudnn) Set Tactic Name: volta_scudnn_128x64_relu_interior_nn_v1
[TensorRT] VERBOSE: Tactic: 9091006216302412844 time 0.130016
[TensorRT] VERBOSE: conv1 (scudnn) Set Tactic Name: volta_scudnn_128x64_relu_medium_nn_v1
[TensorRT] VERBOSE: Tactic: -8060443123034038864 time 0.13616
[TensorRT] VERBOSE: conv1 (scudnn) Set Tactic Name: volta_scudnn_128x32_relu_medium_nn_v1
[TensorRT] VERBOSE: Tactic: -4420849921117327522 time 0.082816
[TensorRT] VERBOSE: conv1 (scudnn) Set Tactic Name: volta_scudnn_128x32_relu_small_nn_v1
[TensorRT] VERBOSE: Tactic: -3946921629105938337 time 0.079872
[TensorRT] VERBOSE: Fastest Tactic: 2733356012094739613 Time: 0.07952
[TensorRT] VERBOSE: --------------- Timing Runner: conv1 (CudaConvolution)
[TensorRT] VERBOSE: Tactic: 0 time 0.205056
[TensorRT] VERBOSE: Tactic: 1 time 0.247808
[TensorRT] VERBOSE: Tactic: 2 time 0.27168
[TensorRT] VERBOSE: Fastest Tactic: 0 Time: 0.205056
[TensorRT] VERBOSE: --------------- Timing Runner: conv1 (CudaDepthwiseConvolution)
[TensorRT] VERBOSE: CudaDepthwiseConvolution has no valid tactics for this config, skipping
[TensorRT] VERBOSE: >>>>>>>>>>>>>>> Chose Runner Type: CaskConvolution Tactic: 2733356012094739613
[TensorRT] VERBOSE: conv1 (scudnn) Set Tactic Name: volta_scudnn_128x32_relu_interior_nn_v1
[TensorRT] VERBOSE: 
[TensorRT] VERBOSE: *************** Autotuning format combination: Int8(1,28,784:4,784) -> Float(1,24,576,11520) ***************
[TensorRT] VERBOSE: --------------- Timing Runner: conv1 (LegacySASSConvolution)
[TensorRT] VERBOSE: LegacySASSConvolution has no valid tactics for this config, skipping
[TensorRT] VERBOSE: --------------- Timing Runner: conv1 (CaskConvolution)
[TensorRT] VERBOSE: conv1 (icudnn) Set Tactic Name: volta_fp32_icudnn_int8x4_128x128_relu_medium_nn_v1
[TensorRT] VERBOSE: Tactic: 892787096507693407 time 0.339776
[TensorRT] VERBOSE: conv1 (icudnn) Set Tactic Name: volta_fp32_icudnn_int8x4_128x32_relu_xregs_medium_nn_v1
[TensorRT] VERBOSE: Tactic: 1204440019753223942 time 0.13216
[TensorRT] VERBOSE: conv1 (icudnn) Set Tactic Name: volta_fp32_icudnn_int8x4_128x32_relu_small_nn_v1
[TensorRT] VERBOSE: Tactic: 1659301557717208403 time 0.107584
[TensorRT] VERBOSE: conv1 (icudnn) Set Tactic Name: volta_fp32_icudnn_int8x4_128x64_relu_medium_nn_v1
[TensorRT] VERBOSE: Tactic: 2057291331119027912 time 0.168
[TensorRT] VERBOSE: conv1 (icudnn) Set Tactic Name: volta_fp32_icudnn_int8x4_128x32_relu_xregs_small_nn_v1
[TensorRT] VERBOSE: Tactic: 3275977259705528576 time 0.11728
[TensorRT] VERBOSE: conv1 (icudnn) Set Tactic Name: volta_fp32_icudnn_int8x4_128x32_relu_medium_nn_v1
[TensorRT] VERBOSE: Tactic: 5623454780463195174 time 0.102432
[TensorRT] VERBOSE: conv1 (icudnn) Set Tactic Name: volta_fp32_icudnn_int8x4_128x64_relu_xregs_large_nn_v1
[TensorRT] VERBOSE: Tactic: 8930254200803946944 time 0.186592
[TensorRT] VERBOSE: conv1 (icudnn) Set Tactic Name: volta_fp32_icudnn_int8x4_128x64_relu_small_nn_v1
[TensorRT] VERBOSE: Tactic: -9204333525109552344 time 0.164864
[TensorRT] VERBOSE: conv1 (icudnn) Set Tactic Name: volta_fp32_icudnn_int8x4_128x64_relu_interior_nn_v1
[TensorRT] VERBOSE: Tactic: -7924103240988931433 time 0.161888
[TensorRT] VERBOSE: conv1 (icudnn) Set Tactic Name: volta_fp32_icudnn_int8x4_128x32_relu_xregs_interior_nn_v1
[TensorRT] VERBOSE: Tactic: -7489650117016530013 time 0.113664
[TensorRT] VERBOSE: conv1 (icudnn) Set Tactic Name: volta_fp32_icudnn_int8x4_128x128_relu_small_nn_v1
[TensorRT] VERBOSE: Tactic: -4973811344878172338 time 0.31856
[TensorRT] VERBOSE: conv1 (icudnn) Set Tactic Name: volta_fp32_icudnn_int8x4_128x32_relu_interior_nn_v1
[TensorRT] VERBOSE: Tactic: -3908975881807046106 time 0.093536
[TensorRT] VERBOSE: conv1 (icudnn) Set Tactic Name: volta_fp32_icudnn_int8x4_128x128_relu_interior_nn_v1
[TensorRT] VERBOSE: Tactic: -1765942417666394360 time 0.31264
[TensorRT] VERBOSE: conv1 (icudnn) Set Tactic Name: volta_fp32_icudnn_int8x4_128x128_relu_xregs_large_nn_v1
[TensorRT] VERBOSE: Tactic: -1228371230285617088 time 0.476256
[TensorRT] VERBOSE: Fastest Tactic: -3908975881807046106 Time: 0.093536
[TensorRT] VERBOSE: --------------- Timing Runner: conv1 (CudaConvolution)
[TensorRT] VERBOSE: CudaConvolution has no valid tactics for this config, skipping
[TensorRT] VERBOSE: --------------- Timing Runner: conv1 (CudaDepthwiseConvolution)
[TensorRT] VERBOSE: CudaDepthwiseConvolution has no valid tactics for this config, skipping
[TensorRT] VERBOSE: --------------- Timing Runner: conv1 (CudaGroupConvolution)
[TensorRT] VERBOSE: CudaGroupConvolution has no valid tactics for this config, skipping
[TensorRT] VERBOSE: >>>>>>>>>>>>>>> Chose Runner Type: CaskConvolution Tactic: -3908975881807046106
[TensorRT] VERBOSE: conv1 (icudnn) Set Tactic Name: volta_fp32_icudnn_int8x4_128x32_relu_interior_nn_v1
[TensorRT] VERBOSE: 
[TensorRT] VERBOSE: *************** Autotuning format combination: Int8(1,28,784:4,784) -> Int8(1,24,576:4,2880) ***************
[TensorRT] VERBOSE: --------------- Timing Runner: conv1 (LegacySASSConvolution)
[TensorRT] VERBOSE: LegacySASSConvolution has no valid tactics for this config, skipping
[TensorRT] VERBOSE: --------------- Timing Runner: conv1 (CaskConvolution)
[TensorRT] VERBOSE: conv1 (icudnn) Set Tactic Name: volta_int8x4_icudnn_int8x4_128x64_relu_interior_nn_v1
[TensorRT] VERBOSE: Tactic: 3145259992339075399 time 0.139264
[TensorRT] VERBOSE: conv1 (icudnn) Set Tactic Name: volta_int8x4_icudnn_int8x4_128x128_relu_interior_nn_v1
[TensorRT] VERBOSE: Tactic: 4000990898022781625 time 0.272416
[TensorRT] VERBOSE: conv1 (icudnn) Set Tactic Name: volta_int8x4_icudnn_int8x4_128x64_relu_medium_nn_v1
[TensorRT] VERBOSE: Tactic: 4438325421691896755 time 0.146144
[TensorRT] VERBOSE: conv1 (icudnn) Set Tactic Name: volta_int8x4_icudnn_int8x4_128x64_relu_small_nn_v1
[TensorRT] VERBOSE: Tactic: 4581732244273465060 time 0.14336
[TensorRT] VERBOSE: conv1 (icudnn) Set Tactic Name: volta_int8x4_icudnn_int8x4_128x32_relu_xregs_medium_nn_v1
[TensorRT] VERBOSE: Tactic: 4934335053031119367 time 0.101376
[TensorRT] VERBOSE: conv1 (icudnn) Set Tactic Name: volta_int8x4_icudnn_int8x4_128x128_relu_medium_nn_v1
[TensorRT] VERBOSE: Tactic: 6797040896965118050 time 0.275744
[TensorRT] VERBOSE: conv1 (icudnn) Set Tactic Name: volta_int8x4_icudnn_int8x4_128x32_relu_medium_nn_v1
[TensorRT] VERBOSE: Tactic: 8006952294591770973 time 0.086784
[TensorRT] VERBOSE: conv1 (icudnn) Set Tactic Name: volta_int8x4_icudnn_int8x4_128x32_relu_interior_nn_v1
[TensorRT] VERBOSE: Tactic: 8097855305881829878 time 0.077792
[TensorRT] VERBOSE: conv1 (icudnn) Set Tactic Name: volta_int8x4_icudnn_int8x4_128x128_relu_small_nn_v1
[TensorRT] VERBOSE: Tactic: -7210942453088153035 time 0.27072
[TensorRT] VERBOSE: conv1 (icudnn) Set Tactic Name: volta_int8x4_icudnn_int8x4_128x32_relu_small_nn_v1
[TensorRT] VERBOSE: Tactic: -6282183216199417697 time 0.082144
[TensorRT] VERBOSE: conv1 (icudnn) Set Tactic Name: volta_int8x4_icudnn_int8x4_128x128_relu_xregs_large_nn_v1
[TensorRT] VERBOSE: Tactic: -5026383765466876607 time 0.389312
[TensorRT] VERBOSE: conv1 (icudnn) Set Tactic Name: volta_int8x4_icudnn_int8x4_128x32_relu_xregs_small_nn_v1
[TensorRT] VERBOSE: Tactic: -5016725782072253841 time 0.09472
[TensorRT] VERBOSE: conv1 (icudnn) Set Tactic Name: volta_int8x4_icudnn_int8x4_128x32_relu_xregs_interior_nn_v1
[TensorRT] VERBOSE: Tactic: -1543391652455542154 time 0.095264
[TensorRT] VERBOSE: conv1 (icudnn) Set Tactic Name: volta_int8x4_icudnn_int8x4_128x64_relu_xregs_large_nn_v1
[TensorRT] VERBOSE: Tactic: -1370999262391786833 time 0.159584
[TensorRT] VERBOSE: Fastest Tactic: 8097855305881829878 Time: 0.077792
[TensorRT] VERBOSE: --------------- Timing Runner: conv1 (CudaConvolution)
[TensorRT] VERBOSE: CudaConvolution has no valid tactics for this config, skipping
[TensorRT] VERBOSE: --------------- Timing Runner: conv1 (CudaDepthwiseConvolution)
[TensorRT] VERBOSE: CudaDepthwiseConvolution has no valid tactics for this config, skipping
[TensorRT] VERBOSE: --------------- Timing Runner: conv1 (CudaGroupConvolution)
[TensorRT] VERBOSE: CudaGroupConvolution has no valid tactics for this config, skipping
[TensorRT] VERBOSE: >>>>>>>>>>>>>>> Chose Runner Type: CaskConvolution Tactic: 8097855305881829878
[TensorRT] VERBOSE: conv1 (icudnn) Set Tactic Name: volta_int8x4_icudnn_int8x4_128x32_relu_interior_nn_v1
[TensorRT] VERBOSE: 
[TensorRT] VERBOSE: *************** Autotuning format combination: Int8(1,28,784:4,784) -> Int8(1,24,576:32,576) ***************
[TensorRT] VERBOSE: --------------- Timing Runner: conv1 (LegacySASSConvolution)
[TensorRT] VERBOSE: LegacySASSConvolution has no valid tactics for this config, skipping
[TensorRT] VERBOSE: --------------- Timing Runner: conv1 (CaskConvolution)
[TensorRT] VERBOSE: conv1 (icudnn) Set Tactic Name: volta_int8x4_icudnn_int8x4_128x128_relu_interior_c32_nn_v1
[TensorRT] VERBOSE: Tactic: 1025026069226666066 time 0.26528
[TensorRT] VERBOSE: conv1 (icudnn) Set Tactic Name: volta_int8x4_icudnn_int8x4_128x32_relu_xregs_medium_c32_nn_v1
[TensorRT] VERBOSE: Tactic: 1213457772632185722 time 0.100256
[TensorRT] VERBOSE: conv1 (icudnn) Set Tactic Name: volta_int8x4_icudnn_int8x4_128x32_relu_medium_c32_nn_v1
[TensorRT] VERBOSE: Tactic: 1713441381477652893 time 0.085184
[TensorRT] VERBOSE: conv1 (icudnn) Set Tactic Name: volta_int8x4_icudnn_int8x4_128x64_relu_interior_c32_nn_v1
[TensorRT] VERBOSE: Tactic: 2339361327868109050 time 0.140288
[TensorRT] VERBOSE: conv1 (icudnn) Set Tactic Name: volta_int8x4_icudnn_int8x4_128x64_relu_xregs_large_c32_nn_v1
[TensorRT] VERBOSE: Tactic: 7125598890155666458 time 0.152576
[TensorRT] VERBOSE: conv1 (icudnn) Set Tactic Name: volta_int8x4_icudnn_int8x4_128x32_relu_small_c32_nn_v1
[TensorRT] VERBOSE: Tactic: 8047041638267142825 time 0.083488
[TensorRT] VERBOSE: conv1 (icudnn) Set Tactic Name: volta_int8x4_icudnn_int8x4_128x64_relu_small_c32_nn_v1
[TensorRT] VERBOSE: Tactic: -7846982807478255793 time 0.142656
[TensorRT] VERBOSE: conv1 (icudnn) Set Tactic Name: volta_int8x4_icudnn_int8x4_128x32_relu_xregs_interior_c32_nn_v1
[TensorRT] VERBOSE: Tactic: -7686150779628967382 time 0.092384
[TensorRT] VERBOSE: conv1 (icudnn) Set Tactic Name: volta_int8x4_icudnn_int8x4_128x32_relu_xregs_small_c32_nn_v1
[TensorRT] VERBOSE: Tactic: -6459719113600909000 time 0.095616
[TensorRT] VERBOSE: conv1 (icudnn) Set Tactic Name: volta_int8x4_icudnn_int8x4_128x128_relu_small_c32_nn_v1
[TensorRT] VERBOSE: Tactic: -4573925292554651334 time 0.266112
[TensorRT] VERBOSE: conv1 (icudnn) Set Tactic Name: volta_int8x4_icudnn_int8x4_128x32_relu_interior_c32_nn_v1
[TensorRT] VERBOSE: Tactic: -4208188808979933945 time 0.08064
[TensorRT] VERBOSE: conv1 (icudnn) Set Tactic Name: volta_int8x4_icudnn_int8x4_128x64_relu_medium_c32_nn_v1
[TensorRT] VERBOSE: Tactic: -3566249366964946311 time 0.146016
[TensorRT] VERBOSE: conv1 (icudnn) Set Tactic Name: volta_int8x4_icudnn_int8x4_128x128_relu_medium_c32_nn_v1
[TensorRT] VERBOSE: Tactic: -2002418013575043687 time 0.265376
[TensorRT] VERBOSE: conv1 (icudnn) Set Tactic Name: volta_int8x4_icudnn_int8x4_128x128_relu_xregs_large_c32_nn_v1
[TensorRT] VERBOSE: Tactic: -1659631603542281459 time 0.3848
[TensorRT] VERBOSE: Fastest Tactic: -4208188808979933945 Time: 0.08064
[TensorRT] VERBOSE: --------------- Timing Runner: conv1 (CudaConvolution)
[TensorRT] VERBOSE: CudaConvolution has no valid tactics for this config, skipping
[TensorRT] VERBOSE: --------------- Timing Runner: conv1 (CudaDepthwiseConvolution)
[TensorRT] VERBOSE: CudaDepthwiseConvolution has no valid tactics for this config, skipping
[TensorRT] VERBOSE: --------------- Timing Runner: conv1 (CudaGroupConvolution)
[TensorRT] VERBOSE: CudaGroupConvolution has no valid tactics for this config, skipping
[TensorRT] VERBOSE: >>>>>>>>>>>>>>> Chose Runner Type: CaskConvolution Tactic: -4208188808979933945
[TensorRT] VERBOSE: conv1 (icudnn) Set Tactic Name: volta_int8x4_icudnn_int8x4_128x32_relu_interior_c32_nn_v1
[TensorRT] VERBOSE: 
[TensorRT] VERBOSE: *************** Autotuning format combination: Int8(1,28,784:32,784) -> Float(1,24,576:32,576) ***************
[TensorRT] VERBOSE: --------------- Timing Runner: conv1 (LegacySASSConvolution)
[TensorRT] VERBOSE: LegacySASSConvolution has no valid tactics for this config, skipping
[TensorRT] VERBOSE: --------------- Timing Runner: conv1 (CaskConvolution)
[TensorRT] VERBOSE: CaskConvolution has no valid tactics for this config, skipping
[TensorRT] VERBOSE: --------------- Timing Runner: conv1 (CudaConvolution)
[TensorRT] VERBOSE: CudaConvolution has no valid tactics for this config, skipping
[TensorRT] VERBOSE: --------------- Timing Runner: conv1 (CudaDepthwiseConvolution)
[TensorRT] VERBOSE: CudaDepthwiseConvolution has no valid tactics for this config, skipping
[TensorRT] VERBOSE: --------------- Timing Runner: conv1 (CudaGroupConvolution)
[TensorRT] VERBOSE: CudaGroupConvolution has no valid tactics for this config, skipping
[TensorRT] VERBOSE: *************** Autotuning format combination: Int8(1,28,784:32,784) -> Int8(1,24,576:32,576) ***************
[TensorRT] VERBOSE: --------------- Timing Runner: conv1 (LegacySASSConvolution)
[TensorRT] VERBOSE: LegacySASSConvolution has no valid tactics for this config, skipping
[TensorRT] VERBOSE: --------------- Timing Runner: conv1 (CaskConvolution)
[TensorRT] VERBOSE: conv1 (i8816cudnn) Set Tactic Name: volta_int8_i8816cudnn_int8_128x128_ldg16_relu_medium_nt_v1
[TensorRT] VERBOSE: Tactic: 66319348402778770 time 0.375136
[TensorRT] VERBOSE: conv1 (i8816cudnn) Set Tactic Name: volta_int8_i8816cudnn_int8_256x64_ldg16_relu_large_nt_v1
[TensorRT] VERBOSE: Tactic: 1931698692231796048 time 0.230784
[TensorRT] VERBOSE: conv1 (i8816cudnn) Set Tactic Name: volta_int8_i8816cudnn_int8_256x128_ldg16_relu_medium_nt_v1
[TensorRT] VERBOSE: Tactic: 2271687430539765460 time 0.392576
[TensorRT] VERBOSE: conv1 (i8816cudnn) Set Tactic Name: volta_int8_i8816cudnn_int8_128x128_ldg16_relu_interior_nt_v1
[TensorRT] VERBOSE: Tactic: 5754467717466343388 time 0.370688
[TensorRT] VERBOSE: conv1 (i8816cudnn) Set Tactic Name: volta_int8_i8816cudnn_int8_256x64_ldg16_relu_small_nt_v1
[TensorRT] VERBOSE: Tactic: 7039764449991095921 time 0.218816
[TensorRT] VERBOSE: conv1 (i8816cudnn) Set Tactic Name: volta_int8_i8816cudnn_int8_256x128_ldg16_relu_interior_nt_v1
[TensorRT] VERBOSE: Tactic: 7584772692956718645 time 0.388096
[TensorRT] VERBOSE: conv1 (i8816cudnn) Set Tactic Name: volta_int8_i8816cudnn_int8_256x64_ldg16_relu_singleBuffer_medium_nt_v1
[TensorRT] VERBOSE: Tactic: -9114895246540757312 time 0.211424
[TensorRT] VERBOSE: conv1 (i8816cudnn) Set Tactic Name: volta_int8_i8816cudnn_int8_128x128_ldg16_relu_large_nt_v1
[TensorRT] VERBOSE: Tactic: -8787970778927801941 time 0.379872
[TensorRT] VERBOSE: conv1 (i8816cudnn) Set Tactic Name: volta_int8_i8816cudnn_int8_256x128_ldg16_relu_large_nt_v1
[TensorRT] VERBOSE: Tactic: -8225786209923559953 time 0.396256
[TensorRT] VERBOSE: conv1 (i8816cudnn) Set Tactic Name: volta_int8_i8816cudnn_int8_256x64_ldg16_relu_singleBuffer_large_nt_v1
[TensorRT] VERBOSE: Tactic: -7373087278866484214 time 0.216064
[TensorRT] VERBOSE: conv1 (i8816cudnn) Set Tactic Name: volta_int8_i8816cudnn_int8_256x64_ldg16_relu_medium_nt_v1
[TensorRT] VERBOSE: Tactic: -7274936339335021260 time 0.220064
[TensorRT] VERBOSE: conv1 (i8816cudnn) Set Tactic Name: volta_int8_i8816cudnn_int8_256x64_ldg16_relu_singleBuffer_small_nt_v1
[TensorRT] VERBOSE: Tactic: -2102888629196925141 time 0.207392
[TensorRT] VERBOSE: conv1 (i8816cudnn) Set Tactic Name: volta_int8_i8816cudnn_int8_256x64_ldg16_relu_singleBuffer_interior_nt_v1
[TensorRT] VERBOSE: Tactic: -1383447415429797909 time 0.196416
[TensorRT] VERBOSE: conv1 (i8816cudnn) Set Tactic Name: volta_int8_i8816cudnn_int8_256x64_ldg16_relu_interior_nt_v1
[TensorRT] VERBOSE: Tactic: -743032628982127825 time 0.207744
[TensorRT] VERBOSE: conv1 (i8816cudnn) Set Tactic Name: volta_int8_i8816cudnn_int8_256x128_ldg16_relu_small_nt_v1
[TensorRT] VERBOSE: Tactic: -674235064782459186 time 0.392288
[TensorRT] VERBOSE: conv1 (i8816cudnn) Set Tactic Name: volta_int8_i8816cudnn_int8_128x128_ldg16_relu_small_nt_v1
[TensorRT] VERBOSE: Tactic: -182858804213663094 time 0.35184
[TensorRT] VERBOSE: Fastest Tactic: -1383447415429797909 Time: 0.196416
[TensorRT] VERBOSE: --------------- Timing Runner: conv1 (CudaConvolution)
[TensorRT] VERBOSE: CudaConvolution has no valid tactics for this config, skipping
[TensorRT] VERBOSE: --------------- Timing Runner: conv1 (CudaDepthwiseConvolution)
[TensorRT] VERBOSE: CudaDepthwiseConvolution has no valid tactics for this config, skipping
[TensorRT] VERBOSE: --------------- Timing Runner: conv1 (CudaGroupConvolution)
[TensorRT] VERBOSE: CudaGroupConvolution has no valid tactics for this config, skipping
[TensorRT] VERBOSE: >>>>>>>>>>>>>>> Chose Runner Type: CaskConvolution Tactic: -1383447415429797909
[TensorRT] VERBOSE: conv1 (i8816cudnn) Set Tactic Name: volta_int8_i8816cudnn_int8_256x64_ldg16_relu_singleBuffer_interior_nt_v1
[TensorRT] VERBOSE: 
[TensorRT] VERBOSE: --------------- Timing Runner: <reformat> (Reformat)
[TensorRT] VERBOSE: Tactic: 1002 time 0.191392
[TensorRT] VERBOSE: Tactic: 0 time 0.030272
[TensorRT] VERBOSE: Fastest Tactic: 0 Time: 0.030272
[TensorRT] VERBOSE: --------------- Timing Runner: <reformat> (Reformat)
[TensorRT] VERBOSE: Tactic: 1002 time 0.192512
[TensorRT] VERBOSE: Tactic: 0 time 0.17248
[TensorRT] VERBOSE: Fastest Tactic: 0 Time: 0.17248
[TensorRT] VERBOSE: --------------- Timing Runner: <reformat> (Reformat)
[TensorRT] VERBOSE: Tactic: 1002 time 0.196608
[TensorRT] VERBOSE: Tactic: 0 time 0.125888
[TensorRT] VERBOSE: Fastest Tactic: 0 Time: 0.125888
[TensorRT] VERBOSE: --------------- Timing Runner: <reformat> (Reformat)
[TensorRT] VERBOSE: Tactic: 1002 time 0.193696
[TensorRT] VERBOSE: Tactic: 0 time 0.114048
[TensorRT] VERBOSE: Fastest Tactic: 0 Time: 0.114048
[TensorRT] VERBOSE: --------------- Timing Runner: <reformat> (Reformat)
[TensorRT] VERBOSE: Tactic: 1002 time 0.163776
[TensorRT] VERBOSE: Tactic: 0 time 0.220096
[TensorRT] VERBOSE: Fastest Tactic: 1002 Time: 0.163776
[TensorRT] VERBOSE: --------------- Timing Runner: <reformat> (Reformat)
[TensorRT] VERBOSE: Tactic: 1002 time 0.245568
[TensorRT] VERBOSE: Tactic: 0 time 0.042752
[TensorRT] VERBOSE: Fastest Tactic: 0 Time: 0.042752
[TensorRT] VERBOSE: --------------- Timing Runner: <reformat> (Reformat)
[TensorRT] VERBOSE: Tactic: 1002 time 0.199712
[TensorRT] VERBOSE: Tactic: 0 time 0.020608
[TensorRT] VERBOSE: Fastest Tactic: 0 Time: 0.020608
[TensorRT] VERBOSE: --------------- Timing Runner: <reformat> (Reformat)
[TensorRT] VERBOSE: Tactic: 1002 time 0.24992
[TensorRT] VERBOSE: Tactic: 0 time 0.079552
[TensorRT] VERBOSE: Fastest Tactic: 0 Time: 0.079552
[TensorRT] VERBOSE: --------------- Timing Runner: <reformat> (Reformat)
[TensorRT] VERBOSE: Tactic: 1002 time 0.195488
[TensorRT] VERBOSE: Tactic: 0 time 0.0208
[TensorRT] VERBOSE: Fastest Tactic: 0 Time: 0.0208
[TensorRT] VERBOSE: *************** Autotuning format combination: Float(1,24,576,11520) -> Float(1,12,144,2880) ***************
[TensorRT] VERBOSE: --------------- Timing Runner: pool1 (Pooling)
[TensorRT] VERBOSE: Tactic: -1 time 0.036832
[TensorRT] VERBOSE: Fastest Tactic: -1 Time: 0.036832
[TensorRT] VERBOSE: --------------- Timing Runner: pool1 (TiledPooling)
[TensorRT] VERBOSE: Tactic: 5505281 time 0.107488
[TensorRT] VERBOSE: Tactic: 5570817 time 0.067552
[TensorRT] VERBOSE: Tactic: 5636353 time 0.054272
[TensorRT] VERBOSE: Tactic: 5701889 time 0.04912
[TensorRT] VERBOSE: Tactic: 5767425 time 0.04304
[TensorRT] VERBOSE: Tactic: 5832961 time 0.047424
[TensorRT] VERBOSE: Tactic: 5898497 time 0.044
[TensorRT] VERBOSE: Tactic: 5964033 time 0.049184
[TensorRT] VERBOSE: Tactic: 6029569 time 0.060416
[TensorRT] VERBOSE: Tactic: 6095105 time 0.04096
[TensorRT] VERBOSE: Tactic: 6160641 time 0.038016
[TensorRT] VERBOSE: Tactic: 6226177 time 0.03792
[TensorRT] VERBOSE: Tactic: 6291713 time 0.037216
[TensorRT] VERBOSE: Tactic: 6357249 time 0.03792
[TensorRT] VERBOSE: Tactic: 6422785 time 0.037216
[TensorRT] VERBOSE: Tactic: 6488321 time 0.040352
[TensorRT] VERBOSE: Fastest Tactic: 6291713 Time: 0.037216
[TensorRT] VERBOSE: >>>>>>>>>>>>>>> Chose Runner Type: Pooling Tactic: -1
[TensorRT] VERBOSE: 
[TensorRT] VERBOSE: *************** Autotuning format combination: Int8(1,24,576:4,2880) -> Int8(1,12,144:4,720) ***************
[TensorRT] VERBOSE: --------------- Timing Runner: pool1 (Pooling)
[TensorRT] VERBOSE: Pooling has no valid tactics for this config, skipping
[TensorRT] VERBOSE: --------------- Timing Runner: pool1 (TiledPooling)
[TensorRT] VERBOSE: Tactic: 5505281 time 0.042976
[TensorRT] VERBOSE: Tactic: 5570817 time 0.035232
[TensorRT] VERBOSE: Tactic: 5636353 time 0.033152
[TensorRT] VERBOSE: Tactic: 5701889 time 0.036864
[TensorRT] VERBOSE: Tactic: 5767425 time 0.030816
[TensorRT] VERBOSE: Tactic: 5832961 time 0.03072
[TensorRT] VERBOSE: Tactic: 5898497 time 0.031072
[TensorRT] VERBOSE: Tactic: 5964033 time 0.032768
[TensorRT] VERBOSE: Tactic: 6029569 time 0.026656
[TensorRT] VERBOSE: Tactic: 6095105 time 0.021888
[TensorRT] VERBOSE: Tactic: 6160641 time 0.021632
[TensorRT] VERBOSE: Tactic: 6226177 time 0.024576
[TensorRT] VERBOSE: Tactic: 6291713 time 0.021824
[TensorRT] VERBOSE: Tactic: 6357249 time 0.022528
[TensorRT] VERBOSE: Tactic: 6422785 time 0.022656
[TensorRT] VERBOSE: Tactic: 6488321 time 0.021792
[TensorRT] VERBOSE: Fastest Tactic: 6160641 Time: 0.021632
[TensorRT] VERBOSE: >>>>>>>>>>>>>>> Chose Runner Type: TiledPooling Tactic: 6160641
[TensorRT] VERBOSE: 
[TensorRT] VERBOSE: *************** Autotuning format combination: Int8(1,24,576:32,576) -> Int8(1,12,144:32,144) ***************
[TensorRT] VERBOSE: --------------- Timing Runner: pool1 (Pooling)
[TensorRT] VERBOSE: Tactic: -4 time 0.02016
[TensorRT] VERBOSE: Fastest Tactic: -4 Time: 0.02016
[TensorRT] VERBOSE: --------------- Timing Runner: pool1 (TiledPooling)
[TensorRT] VERBOSE: TiledPooling has no valid tactics for this config, skipping
[TensorRT] VERBOSE: >>>>>>>>>>>>>>> Chose Runner Type: Pooling Tactic: -4
[TensorRT] VERBOSE: 
[TensorRT] VERBOSE: --------------- Timing Runner: <reformat> (Reformat)
[TensorRT] VERBOSE: Tactic: 1002 time 0.057344
[TensorRT] VERBOSE: Tactic: 0 time 0.009312
[TensorRT] VERBOSE: Fastest Tactic: 0 Time: 0.009312
[TensorRT] VERBOSE: --------------- Timing Runner: <reformat> (Reformat)
[TensorRT] VERBOSE: Tactic: 1002 time 0.05808
[TensorRT] VERBOSE: Tactic: 0 time 0.048256
[TensorRT] VERBOSE: Fastest Tactic: 0 Time: 0.048256
[TensorRT] VERBOSE: --------------- Timing Runner: <reformat> (Reformat)
[TensorRT] VERBOSE: Tactic: 1002 time 0.070528
[TensorRT] VERBOSE: Tactic: 0 time 0.012384
[TensorRT] VERBOSE: Fastest Tactic: 0 Time: 0.012384
[TensorRT] VERBOSE: --------------- Timing Runner: <reformat> (Reformat)
[TensorRT] VERBOSE: Tactic: 1002 time 0.058976
[TensorRT] VERBOSE: Tactic: 0 time 0.00928
[TensorRT] VERBOSE: Fastest Tactic: 0 Time: 0.00928
[TensorRT] VERBOSE: --------------- Timing Runner: <reformat> (Reformat)
[TensorRT] VERBOSE: Tactic: 1002 time 0.07072
[TensorRT] VERBOSE: Tactic: 0 time 0.024544
[TensorRT] VERBOSE: Fastest Tactic: 0 Time: 0.024544
[TensorRT] VERBOSE: --------------- Timing Runner: <reformat> (Reformat)
[TensorRT] VERBOSE: Tactic: 1002 time 0.0576
[TensorRT] VERBOSE: Tactic: 0 time 0.009216
[TensorRT] VERBOSE: Fastest Tactic: 0 Time: 0.009216
[TensorRT] VERBOSE: *************** Autotuning format combination: Float(1,12,144,2880) -> Float(1,8,64,3200) ***************
[TensorRT] VERBOSE: --------------- Timing Runner: conv2 (LegacySASSConvolution)
[TensorRT] VERBOSE: LegacySASSConvolution has no valid tactics for this config, skipping
[TensorRT] VERBOSE: --------------- Timing Runner: conv2 (CaskConvolution)
[TensorRT] VERBOSE: conv2 (scudnn) Set Tactic Name: volta_scudnn_128x128_relu_interior_nn_v1
[TensorRT] VERBOSE: Tactic: 1754569683116234317 time 0.332768
[TensorRT] VERBOSE: conv2 (scudnn) Set Tactic Name: volta_scudnn_128x128_relu_medium_nn_v1
[TensorRT] VERBOSE: Tactic: 1825138533642645384 time 0.33376
[TensorRT] VERBOSE: conv2 (scudnn) Set Tactic Name: volta_scudnn_128x32_relu_interior_nn_v1
[TensorRT] VERBOSE: Tactic: 2733356012094739613 time 0.191616
[TensorRT] VERBOSE: conv2 (scudnn) Set Tactic Name: volta_scudnn_128x64_relu_xregs_large_nn_v1
[TensorRT] VERBOSE: Tactic: 2842488832350522458 time 0.177856
[TensorRT] VERBOSE: conv2 (scudnn) Set Tactic Name: volta_scudnn_128x128_relu_small_nn_v1
[TensorRT] VERBOSE: Tactic: 3915320020053085238 time 0.33216
[TensorRT] VERBOSE: conv2 (scudnn) Set Tactic Name: volta_scudnn_128x128_relu_xregs_large_nn_v1
[TensorRT] VERBOSE: Tactic: 6448355332020552203 time 0.34336
[TensorRT] VERBOSE: conv2 (scudnn) Set Tactic Name: volta_scudnn_128x64_relu_small_nn_v1
[TensorRT] VERBOSE: Tactic: 6808617066150061604 time 0.179264
[TensorRT] VERBOSE: conv2 (scudnn) Set Tactic Name: volta_scudnn_128x64_relu_interior_nn_v1
[TensorRT] VERBOSE: Tactic: 9091006216302412844 time 0.173568
[TensorRT] VERBOSE: conv2 (scudnn) Set Tactic Name: volta_scudnn_128x64_relu_medium_nn_v1
[TensorRT] VERBOSE: Tactic: -8060443123034038864 time 0.181056
[TensorRT] VERBOSE: conv2 (scudnn) Set Tactic Name: volta_scudnn_128x32_relu_medium_nn_v1
[TensorRT] VERBOSE: Tactic: -4420849921117327522 time 0.181248
[TensorRT] VERBOSE: conv2 (scudnn) Set Tactic Name: volta_scudnn_128x32_relu_small_nn_v1
[TensorRT] VERBOSE: Tactic: -3946921629105938337 time 0.197856
[TensorRT] VERBOSE: Fastest Tactic: 9091006216302412844 Time: 0.173568
[TensorRT] VERBOSE: --------------- Timing Runner: conv2 (CudaConvolution)
[TensorRT] VERBOSE: Tactic: 0 time 0.271424
[TensorRT] VERBOSE: Tactic: 1 time 0.196
[TensorRT] VERBOSE: Tactic: 2 time 0.346816
[TensorRT] VERBOSE: Fastest Tactic: 1 Time: 0.196
[TensorRT] VERBOSE: --------------- Timing Runner: conv2 (CudaDepthwiseConvolution)
[TensorRT] VERBOSE: CudaDepthwiseConvolution has no valid tactics for this config, skipping
[TensorRT] VERBOSE: >>>>>>>>>>>>>>> Chose Runner Type: CaskConvolution Tactic: 9091006216302412844
[TensorRT] VERBOSE: conv2 (scudnn) Set Tactic Name: volta_scudnn_128x64_relu_interior_nn_v1
[TensorRT] VERBOSE: 
[TensorRT] VERBOSE: *************** Autotuning format combination: Int8(1,12,144:4,720) -> Float(1,8,64,3200) ***************
[TensorRT] VERBOSE: --------------- Timing Runner: conv2 (LegacySASSConvolution)
[TensorRT] VERBOSE: LegacySASSConvolution has no valid tactics for this config, skipping
[TensorRT] VERBOSE: --------------- Timing Runner: conv2 (CaskConvolution)
[TensorRT] VERBOSE: conv2 (icudnn) Set Tactic Name: volta_fp32_icudnn_int8x4_128x128_relu_medium_nn_v1
[TensorRT] VERBOSE: Tactic: 892787096507693407 time 0.09968
[TensorRT] VERBOSE: conv2 (icudnn) Set Tactic Name: volta_fp32_icudnn_int8x4_128x32_relu_xregs_medium_nn_v1
[TensorRT] VERBOSE: Tactic: 1204440019753223942 time 0.081664
[TensorRT] VERBOSE: conv2 (icudnn) Set Tactic Name: volta_fp32_icudnn_int8x4_128x32_relu_small_nn_v1
[TensorRT] VERBOSE: Tactic: 1659301557717208403 time 0.063456
[TensorRT] VERBOSE: conv2 (icudnn) Set Tactic Name: volta_fp32_icudnn_int8x4_128x64_relu_medium_nn_v1
[TensorRT] VERBOSE: Tactic: 2057291331119027912 time 0.062848
[TensorRT] VERBOSE: conv2 (icudnn) Set Tactic Name: volta_fp32_icudnn_int8x4_128x32_relu_xregs_small_nn_v1
[TensorRT] VERBOSE: Tactic: 3275977259705528576 time 0.0824
[TensorRT] VERBOSE: conv2 (icudnn) Set Tactic Name: volta_fp32_icudnn_int8x4_128x32_relu_medium_nn_v1
[TensorRT] VERBOSE: Tactic: 5623454780463195174 time 0.06688
[TensorRT] VERBOSE: conv2 (icudnn) Set Tactic Name: volta_fp32_icudnn_int8x4_128x64_relu_xregs_large_nn_v1
[TensorRT] VERBOSE: Tactic: 8930254200803946944 time 0.060288
[TensorRT] VERBOSE: conv2 (icudnn) Set Tactic Name: volta_fp32_icudnn_int8x4_128x64_relu_small_nn_v1
[TensorRT] VERBOSE: Tactic: -9204333525109552344 time 0.06144
[TensorRT] VERBOSE: conv2 (icudnn) Set Tactic Name: volta_fp32_icudnn_int8x4_128x64_relu_interior_nn_v1
[TensorRT] VERBOSE: Tactic: -7924103240988931433 time 0.0592
[TensorRT] VERBOSE: conv2 (icudnn) Set Tactic Name: volta_fp32_icudnn_int8x4_128x32_relu_xregs_interior_nn_v1
[TensorRT] VERBOSE: Tactic: -7489650117016530013 time 0.081888
[TensorRT] VERBOSE: conv2 (icudnn) Set Tactic Name: volta_fp32_icudnn_int8x4_128x128_relu_small_nn_v1
[TensorRT] VERBOSE: Tactic: -4973811344878172338 time 0.099136
[TensorRT] VERBOSE: conv2 (icudnn) Set Tactic Name: volta_fp32_icudnn_int8x4_128x32_relu_interior_nn_v1
[TensorRT] VERBOSE: Tactic: -3908975881807046106 time 0.061024
[TensorRT] VERBOSE: conv2 (icudnn) Set Tactic Name: volta_fp32_icudnn_int8x4_128x128_relu_interior_nn_v1
[TensorRT] VERBOSE: Tactic: -1765942417666394360 time 0.099296
[TensorRT] VERBOSE: conv2 (icudnn) Set Tactic Name: volta_fp32_icudnn_int8x4_128x128_relu_xregs_large_nn_v1
[TensorRT] VERBOSE: Tactic: -1228371230285617088 time 0.109472
[TensorRT] VERBOSE: Fastest Tactic: -7924103240988931433 Time: 0.0592
[TensorRT] VERBOSE: --------------- Timing Runner: conv2 (CudaConvolution)
[TensorRT] VERBOSE: CudaConvolution has no valid tactics for this config, skipping
[TensorRT] VERBOSE: --------------- Timing Runner: conv2 (CudaDepthwiseConvolution)
[TensorRT] VERBOSE: CudaDepthwiseConvolution has no valid tactics for this config, skipping
[TensorRT] VERBOSE: --------------- Timing Runner: conv2 (CudaGroupConvolution)
[TensorRT] VERBOSE: CudaGroupConvolution has no valid tactics for this config, skipping
[TensorRT] VERBOSE: >>>>>>>>>>>>>>> Chose Runner Type: CaskConvolution Tactic: -7924103240988931433
[TensorRT] VERBOSE: conv2 (icudnn) Set Tactic Name: volta_fp32_icudnn_int8x4_128x64_relu_interior_nn_v1
[TensorRT] VERBOSE: 
[TensorRT] VERBOSE: *************** Autotuning format combination: Int8(1,12,144:4,720) -> Int8(1,8,64:4,832) ***************
[TensorRT] VERBOSE: --------------- Timing Runner: conv2 (LegacySASSConvolution)
[TensorRT] VERBOSE: LegacySASSConvolution has no valid tactics for this config, skipping
[TensorRT] VERBOSE: --------------- Timing Runner: conv2 (CaskConvolution)
[TensorRT] VERBOSE: conv2 (icudnn) Set Tactic Name: volta_int8x4_icudnn_int8x4_128x64_relu_interior_nn_v1
[TensorRT] VERBOSE: Tactic: 3145259992339075399 time 0.053984
[TensorRT] VERBOSE: conv2 (icudnn) Set Tactic Name: volta_int8x4_icudnn_int8x4_128x128_relu_interior_nn_v1
[TensorRT] VERBOSE: Tactic: 4000990898022781625 time 0.093728
[TensorRT] VERBOSE: conv2 (icudnn) Set Tactic Name: volta_int8x4_icudnn_int8x4_128x64_relu_medium_nn_v1
[TensorRT] VERBOSE: Tactic: 4438325421691896755 time 0.05824
[TensorRT] VERBOSE: conv2 (icudnn) Set Tactic Name: volta_int8x4_icudnn_int8x4_128x64_relu_small_nn_v1
[TensorRT] VERBOSE: Tactic: 4581732244273465060 time 0.046176
[TensorRT] VERBOSE: conv2 (icudnn) Set Tactic Name: volta_int8x4_icudnn_int8x4_128x32_relu_xregs_medium_nn_v1
[TensorRT] VERBOSE: Tactic: 4934335053031119367 time 0.0616
[TensorRT] VERBOSE: conv2 (icudnn) Set Tactic Name: volta_int8x4_icudnn_int8x4_128x128_relu_medium_nn_v1
[TensorRT] VERBOSE: Tactic: 6797040896965118050 time 0.075648
[TensorRT] VERBOSE: conv2 (icudnn) Set Tactic Name: volta_int8x4_icudnn_int8x4_128x32_relu_medium_nn_v1
[TensorRT] VERBOSE: Tactic: 8006952294591770973 time 0.045664
[TensorRT] VERBOSE: conv2 (icudnn) Set Tactic Name: volta_int8x4_icudnn_int8x4_128x32_relu_interior_nn_v1
[TensorRT] VERBOSE: Tactic: 8097855305881829878 time 0.043872
[TensorRT] VERBOSE: conv2 (icudnn) Set Tactic Name: volta_int8x4_icudnn_int8x4_128x128_relu_small_nn_v1
[TensorRT] VERBOSE: Tactic: -7210942453088153035 time 0.075232
[TensorRT] VERBOSE: conv2 (icudnn) Set Tactic Name: volta_int8x4_icudnn_int8x4_128x32_relu_small_nn_v1
[TensorRT] VERBOSE: Tactic: -6282183216199417697 time 0.047232
[TensorRT] VERBOSE: conv2 (icudnn) Set Tactic Name: volta_int8x4_icudnn_int8x4_128x128_relu_xregs_large_nn_v1
[TensorRT] VERBOSE: Tactic: -5026383765466876607 time 0.0808
[TensorRT] VERBOSE: conv2 (icudnn) Set Tactic Name: volta_int8x4_icudnn_int8x4_128x32_relu_xregs_small_nn_v1
[TensorRT] VERBOSE: Tactic: -5016725782072253841 time 0.060032
[TensorRT] VERBOSE: conv2 (icudnn) Set Tactic Name: volta_int8x4_icudnn_int8x4_128x32_relu_xregs_interior_nn_v1
[TensorRT] VERBOSE: Tactic: -1543391652455542154 time 0.044064
[TensorRT] VERBOSE: conv2 (icudnn) Set Tactic Name: volta_int8x4_icudnn_int8x4_128x64_relu_xregs_large_nn_v1
[TensorRT] VERBOSE: Tactic: -1370999262391786833 time 0.044512
[TensorRT] VERBOSE: Fastest Tactic: 8097855305881829878 Time: 0.043872
[TensorRT] VERBOSE: --------------- Timing Runner: conv2 (CudaConvolution)
[TensorRT] VERBOSE: CudaConvolution has no valid tactics for this config, skipping
[TensorRT] VERBOSE: --------------- Timing Runner: conv2 (CudaDepthwiseConvolution)
[TensorRT] VERBOSE: CudaDepthwiseConvolution has no valid tactics for this config, skipping
[TensorRT] VERBOSE: --------------- Timing Runner: conv2 (CudaGroupConvolution)
[TensorRT] VERBOSE: CudaGroupConvolution has no valid tactics for this config, skipping
[TensorRT] VERBOSE: >>>>>>>>>>>>>>> Chose Runner Type: CaskConvolution Tactic: 8097855305881829878
[TensorRT] VERBOSE: conv2 (icudnn) Set Tactic Name: volta_int8x4_icudnn_int8x4_128x32_relu_interior_nn_v1
[TensorRT] VERBOSE: 
[TensorRT] VERBOSE: *************** Autotuning format combination: Int8(1,12,144:4,720) -> Int8(1,8,64:32,128) ***************
[TensorRT] VERBOSE: --------------- Timing Runner: conv2 (LegacySASSConvolution)
[TensorRT] VERBOSE: LegacySASSConvolution has no valid tactics for this config, skipping
[TensorRT] VERBOSE: --------------- Timing Runner: conv2 (CaskConvolution)
[TensorRT] VERBOSE: conv2 (icudnn) Set Tactic Name: volta_int8x4_icudnn_int8x4_128x128_relu_interior_c32_nn_v1
[TensorRT] VERBOSE: Tactic: 1025026069226666066 time 0.076032
[TensorRT] VERBOSE: conv2 (icudnn) Set Tactic Name: volta_int8x4_icudnn_int8x4_128x32_relu_xregs_medium_c32_nn_v1
[TensorRT] VERBOSE: Tactic: 1213457772632185722 time 0.06144
[TensorRT] VERBOSE: conv2 (icudnn) Set Tactic Name: volta_int8x4_icudnn_int8x4_128x32_relu_medium_c32_nn_v1
[TensorRT] VERBOSE: Tactic: 1713441381477652893 time 0.049056
[TensorRT] VERBOSE: conv2 (icudnn) Set Tactic Name: volta_int8x4_icudnn_int8x4_128x64_relu_interior_c32_nn_v1
[TensorRT] VERBOSE: Tactic: 2339361327868109050 time 0.04416
[TensorRT] VERBOSE: conv2 (icudnn) Set Tactic Name: volta_int8x4_icudnn_int8x4_128x64_relu_xregs_large_c32_nn_v1
[TensorRT] VERBOSE: Tactic: 7125598890155666458 time 0.044448
[TensorRT] VERBOSE: conv2 (icudnn) Set Tactic Name: volta_int8x4_icudnn_int8x4_128x32_relu_small_c32_nn_v1
[TensorRT] VERBOSE: Tactic: 8047041638267142825 time 0.047392
[TensorRT] VERBOSE: conv2 (icudnn) Set Tactic Name: volta_int8x4_icudnn_int8x4_128x64_relu_small_c32_nn_v1
[TensorRT] VERBOSE: Tactic: -7846982807478255793 time 0.045152
[TensorRT] VERBOSE: conv2 (icudnn) Set Tactic Name: volta_int8x4_icudnn_int8x4_128x32_relu_xregs_interior_c32_nn_v1
[TensorRT] VERBOSE: Tactic: -7686150779628967382 time 0.06032
[TensorRT] VERBOSE: conv2 (icudnn) Set Tactic Name: volta_int8x4_icudnn_int8x4_128x32_relu_xregs_small_c32_nn_v1
[TensorRT] VERBOSE: Tactic: -6459719113600909000 time 0.062272
[TensorRT] VERBOSE: conv2 (icudnn) Set Tactic Name: volta_int8x4_icudnn_int8x4_128x128_relu_small_c32_nn_v1
[TensorRT] VERBOSE: Tactic: -4573925292554651334 time 0.075424
[TensorRT] VERBOSE: conv2 (icudnn) Set Tactic Name: volta_int8x4_icudnn_int8x4_128x32_relu_interior_c32_nn_v1
[TensorRT] VERBOSE: Tactic: -4208188808979933945 time 0.043904
[TensorRT] VERBOSE: conv2 (icudnn) Set Tactic Name: volta_int8x4_icudnn_int8x4_128x64_relu_medium_c32_nn_v1
[TensorRT] VERBOSE: Tactic: -3566249366964946311 time 0.04576
[TensorRT] VERBOSE: conv2 (icudnn) Set Tactic Name: volta_int8x4_icudnn_int8x4_128x128_relu_medium_c32_nn_v1
[TensorRT] VERBOSE: Tactic: -2002418013575043687 time 0.075616
[TensorRT] VERBOSE: conv2 (icudnn) Set Tactic Name: volta_int8x4_icudnn_int8x4_128x128_relu_xregs_large_c32_nn_v1
[TensorRT] VERBOSE: Tactic: -1659631603542281459 time 0.080896
[TensorRT] VERBOSE: Fastest Tactic: -4208188808979933945 Time: 0.043904
[TensorRT] VERBOSE: --------------- Timing Runner: conv2 (CudaConvolution)
[TensorRT] VERBOSE: CudaConvolution has no valid tactics for this config, skipping
[TensorRT] VERBOSE: --------------- Timing Runner: conv2 (CudaDepthwiseConvolution)
[TensorRT] VERBOSE: CudaDepthwiseConvolution has no valid tactics for this config, skipping
[TensorRT] VERBOSE: --------------- Timing Runner: conv2 (CudaGroupConvolution)
[TensorRT] VERBOSE: CudaGroupConvolution has no valid tactics for this config, skipping
[TensorRT] VERBOSE: >>>>>>>>>>>>>>> Chose Runner Type: CaskConvolution Tactic: -4208188808979933945
[TensorRT] VERBOSE: conv2 (icudnn) Set Tactic Name: volta_int8x4_icudnn_int8x4_128x32_relu_interior_c32_nn_v1
[TensorRT] VERBOSE: 
[TensorRT] VERBOSE: *************** Autotuning format combination: Int8(1,12,144:32,144) -> Float(1,8,64:32,128) ***************
[TensorRT] VERBOSE: --------------- Timing Runner: conv2 (LegacySASSConvolution)
[TensorRT] VERBOSE: LegacySASSConvolution has no valid tactics for this config, skipping
[TensorRT] VERBOSE: --------------- Timing Runner: conv2 (CaskConvolution)
[TensorRT] VERBOSE: CaskConvolution has no valid tactics for this config, skipping
[TensorRT] VERBOSE: --------------- Timing Runner: conv2 (CudaConvolution)
[TensorRT] VERBOSE: CudaConvolution has no valid tactics for this config, skipping
[TensorRT] VERBOSE: --------------- Timing Runner: conv2 (CudaDepthwiseConvolution)
[TensorRT] VERBOSE: CudaDepthwiseConvolution has no valid tactics for this config, skipping
[TensorRT] VERBOSE: --------------- Timing Runner: conv2 (CudaGroupConvolution)
[TensorRT] VERBOSE: CudaGroupConvolution has no valid tactics for this config, skipping
[TensorRT] VERBOSE: *************** Autotuning format combination: Int8(1,12,144:32,144) -> Int8(1,8,64:32,128) ***************
[TensorRT] VERBOSE: --------------- Timing Runner: conv2 (LegacySASSConvolution)
[TensorRT] VERBOSE: LegacySASSConvolution has no valid tactics for this config, skipping
[TensorRT] VERBOSE: --------------- Timing Runner: conv2 (CaskConvolution)
[TensorRT] VERBOSE: conv2 (i8816cudnn) Set Tactic Name: volta_int8_i8816cudnn_int8_128x128_ldg16_relu_medium_nt_v1
[TensorRT] VERBOSE: Tactic: 66319348402778770 time 0.038976
[TensorRT] VERBOSE: conv2 (i8816cudnn) Set Tactic Name: volta_int8_i8816cudnn_int8_256x64_ldg16_relu_large_nt_v1
[TensorRT] VERBOSE: Tactic: 1931698692231796048 time 0.028192
[TensorRT] VERBOSE: conv2 (i8816cudnn) Set Tactic Name: volta_int8_i8816cudnn_int8_256x128_ldg16_relu_medium_nt_v1
[TensorRT] VERBOSE: Tactic: 2271687430539765460 time 0.03904
[TensorRT] VERBOSE: conv2 (i8816cudnn) Set Tactic Name: volta_int8_i8816cudnn_int8_128x128_ldg16_relu_interior_nt_v1
[TensorRT] VERBOSE: Tactic: 5754467717466343388 time 0.039008
[TensorRT] VERBOSE: conv2 (i8816cudnn) Set Tactic Name: volta_int8_i8816cudnn_int8_256x64_ldg16_relu_small_nt_v1
[TensorRT] VERBOSE: Tactic: 7039764449991095921 time 0.027648
[TensorRT] VERBOSE: conv2 (i8816cudnn) Set Tactic Name: volta_int8_i8816cudnn_int8_256x128_ldg16_relu_interior_nt_v1
[TensorRT] VERBOSE: Tactic: 7584772692956718645 time 0.038912
[TensorRT] VERBOSE: conv2 (i8816cudnn) Set Tactic Name: volta_int8_i8816cudnn_int8_256x64_ldg16_relu_singleBuffer_medium_nt_v1
[TensorRT] VERBOSE: Tactic: -9114895246540757312 time 0.026432
[TensorRT] VERBOSE: conv2 (i8816cudnn) Set Tactic Name: volta_int8_i8816cudnn_int8_128x128_ldg16_relu_large_nt_v1
[TensorRT] VERBOSE: Tactic: -8787970778927801941 time 0.04064
[TensorRT] VERBOSE: conv2 (i8816cudnn) Set Tactic Name: volta_int8_i8816cudnn_int8_256x128_ldg16_relu_large_nt_v1
[TensorRT] VERBOSE: Tactic: -8225786209923559953 time 0.039296
[TensorRT] VERBOSE: conv2 (i8816cudnn) Set Tactic Name: volta_int8_i8816cudnn_int8_256x64_ldg16_relu_singleBuffer_large_nt_v1
[TensorRT] VERBOSE: Tactic: -7373087278866484214 time 0.02704
[TensorRT] VERBOSE: conv2 (i8816cudnn) Set Tactic Name: volta_int8_i8816cudnn_int8_256x64_ldg16_relu_medium_nt_v1
[TensorRT] VERBOSE: Tactic: -7274936339335021260 time 0.027904
[TensorRT] VERBOSE: conv2 (i8816cudnn) Set Tactic Name: volta_int8_i8816cudnn_int8_256x64_ldg16_relu_singleBuffer_small_nt_v1
[TensorRT] VERBOSE: Tactic: -2102888629196925141 time 0.026432
[TensorRT] VERBOSE: conv2 (i8816cudnn) Set Tactic Name: volta_int8_i8816cudnn_int8_256x64_ldg16_relu_singleBuffer_interior_nt_v1
[TensorRT] VERBOSE: Tactic: -1383447415429797909 time 0.025184
[TensorRT] VERBOSE: conv2 (i8816cudnn) Set Tactic Name: volta_int8_i8816cudnn_int8_256x64_ldg16_relu_interior_nt_v1
[TensorRT] VERBOSE: Tactic: -743032628982127825 time 0.026496
[TensorRT] VERBOSE: conv2 (i8816cudnn) Set Tactic Name: volta_int8_i8816cudnn_int8_256x128_ldg16_relu_small_nt_v1
[TensorRT] VERBOSE: Tactic: -674235064782459186 time 0.03888
[TensorRT] VERBOSE: conv2 (i8816cudnn) Set Tactic Name: volta_int8_i8816cudnn_int8_128x128_ldg16_relu_small_nt_v1
[TensorRT] VERBOSE: Tactic: -182858804213663094 time 0.038912
[TensorRT] VERBOSE: Fastest Tactic: -1383447415429797909 Time: 0.025184
[TensorRT] VERBOSE: --------------- Timing Runner: conv2 (CudaConvolution)
[TensorRT] VERBOSE: CudaConvolution has no valid tactics for this config, skipping
[TensorRT] VERBOSE: --------------- Timing Runner: conv2 (CudaDepthwiseConvolution)
[TensorRT] VERBOSE: CudaDepthwiseConvolution has no valid tactics for this config, skipping
[TensorRT] VERBOSE: --------------- Timing Runner: conv2 (CudaGroupConvolution)
[TensorRT] VERBOSE: CudaGroupConvolution has no valid tactics for this config, skipping
[TensorRT] VERBOSE: >>>>>>>>>>>>>>> Chose Runner Type: CaskConvolution Tactic: -1383447415429797909
[TensorRT] VERBOSE: conv2 (i8816cudnn) Set Tactic Name: volta_int8_i8816cudnn_int8_256x64_ldg16_relu_singleBuffer_interior_nt_v1
[TensorRT] VERBOSE: 
[TensorRT] VERBOSE: --------------- Timing Runner: <reformat> (Reformat)
[TensorRT] VERBOSE: Tactic: 1002 time 0.044064
[TensorRT] VERBOSE: Tactic: 0 time 0.008672
[TensorRT] VERBOSE: Fastest Tactic: 0 Time: 0.008672
[TensorRT] VERBOSE: --------------- Timing Runner: <reformat> (Reformat)
[TensorRT] VERBOSE: Tactic: 1002 time 0.0424
[TensorRT] VERBOSE: Tactic: 0 time 0.038624
[TensorRT] VERBOSE: Fastest Tactic: 0 Time: 0.038624
[TensorRT] VERBOSE: --------------- Timing Runner: <reformat> (Reformat)
[TensorRT] VERBOSE: Tactic: 1002 time 0.098304
[TensorRT] VERBOSE: Tactic: 0 time 0.02544
[TensorRT] VERBOSE: Fastest Tactic: 0 Time: 0.02544
[TensorRT] VERBOSE: --------------- Timing Runner: <reformat> (Reformat)
[TensorRT] VERBOSE: Tactic: 1002 time 0.04448
[TensorRT] VERBOSE: Tactic: 0 time 0.025536
[TensorRT] VERBOSE: Fastest Tactic: 0 Time: 0.025536
[TensorRT] VERBOSE: --------------- Timing Runner: <reformat> (Reformat)
[TensorRT] VERBOSE: Tactic: 1002 time 0.042944
[TensorRT] VERBOSE: Tactic: 0 time 0.044032
[TensorRT] VERBOSE: Fastest Tactic: 1002 Time: 0.042944
[TensorRT] VERBOSE: --------------- Timing Runner: <reformat> (Reformat)
[TensorRT] VERBOSE: Tactic: 1002 time 0.045696
[TensorRT] VERBOSE: Tactic: 0 time 0.012192
[TensorRT] VERBOSE: Fastest Tactic: 0 Time: 0.012192
[TensorRT] VERBOSE: --------------- Timing Runner: <reformat> (Reformat)
[TensorRT] VERBOSE: Tactic: 1002 time 0.042464
[TensorRT] VERBOSE: Tactic: 0 time 0.008352
[TensorRT] VERBOSE: Fastest Tactic: 0 Time: 0.008352
[TensorRT] VERBOSE: --------------- Timing Runner: <reformat> (Reformat)
[TensorRT] VERBOSE: Tactic: 1002 time 0.047072
[TensorRT] VERBOSE: Tactic: 0 time 0.021664
[TensorRT] VERBOSE: Fastest Tactic: 0 Time: 0.021664
[TensorRT] VERBOSE: --------------- Timing Runner: <reformat> (Reformat)
[TensorRT] VERBOSE: Tactic: 1002 time 0.042624
[TensorRT] VERBOSE: Tactic: 0 time 0.010208
[TensorRT] VERBOSE: Fastest Tactic: 0 Time: 0.010208
[TensorRT] VERBOSE: *************** Autotuning format combination: Float(1,8,64,3200) -> Float(1,4,16,800) ***************
[TensorRT] VERBOSE: --------------- Timing Runner: pool2 (Pooling)
[TensorRT] VERBOSE: Tactic: -1 time 0.010848
[TensorRT] VERBOSE: Fastest Tactic: -1 Time: 0.010848
[TensorRT] VERBOSE: --------------- Timing Runner: pool2 (TiledPooling)
[TensorRT] VERBOSE: Tactic: 5505281 time 0.06912
[TensorRT] VERBOSE: Tactic: 5570817 time 0.044
[TensorRT] VERBOSE: Tactic: 5636353 time 0.036896
[TensorRT] VERBOSE: Tactic: 5701889 time 0.034912
[TensorRT] VERBOSE: Tactic: 5767425 time 0.031744
[TensorRT] VERBOSE: Tactic: 5832961 time 0.031744
[TensorRT] VERBOSE: Tactic: 5898497 time 0.030912
[TensorRT] VERBOSE: Tactic: 5964033 time 0.031712
[TensorRT] VERBOSE: Tactic: 6029569 time 0.03904
[TensorRT] VERBOSE: Tactic: 6095105 time 0.026624
[TensorRT] VERBOSE: Tactic: 6160641 time 0.022528
[TensorRT] VERBOSE: Tactic: 6226177 time 0.021472
[TensorRT] VERBOSE: Tactic: 6291713 time 0.018816
[TensorRT] VERBOSE: Tactic: 6357249 time 0.01936
[TensorRT] VERBOSE: Tactic: 6422785 time 0.019328
[TensorRT] VERBOSE: Tactic: 6488321 time 0.020704
[TensorRT] VERBOSE: Fastest Tactic: 6291713 Time: 0.018816
[TensorRT] VERBOSE: >>>>>>>>>>>>>>> Chose Runner Type: Pooling Tactic: -1
[TensorRT] VERBOSE: 
[TensorRT] VERBOSE: *************** Autotuning format combination: Int8(1,8,64:4,832) -> Int8(1,4,16:4,208) ***************
[TensorRT] VERBOSE: --------------- Timing Runner: pool2 (Pooling)
[TensorRT] VERBOSE: Pooling has no valid tactics for this config, skipping
[TensorRT] VERBOSE: --------------- Timing Runner: pool2 (TiledPooling)
[TensorRT] VERBOSE: Tactic: 5505281 time 0.02992
[TensorRT] VERBOSE: Tactic: 5570817 time 0.024576
[TensorRT] VERBOSE: Tactic: 5636353 time 0.024544
[TensorRT] VERBOSE: Tactic: 5701889 time 0.02576
[TensorRT] VERBOSE: Tactic: 5767425 time 0.021952
[TensorRT] VERBOSE: Tactic: 5832961 time 0.024576
[TensorRT] VERBOSE: Tactic: 5898497 time 0.022528
[TensorRT] VERBOSE: Tactic: 5964033 time 0.023552
[TensorRT] VERBOSE: Tactic: 6029569 time 0.018976
[TensorRT] VERBOSE: Tactic: 6095105 time 0.013696
[TensorRT] VERBOSE: Tactic: 6160641 time 0.015552
[TensorRT] VERBOSE: Tactic: 6226177 time 0.01584
[TensorRT] VERBOSE: Tactic: 6291713 time 0.015744
[TensorRT] VERBOSE: Tactic: 6357249 time 0.016384
[TensorRT] VERBOSE: Tactic: 6422785 time 0.015552
[TensorRT] VERBOSE: Tactic: 6488321 time 0.015424
[TensorRT] VERBOSE: Fastest Tactic: 6095105 Time: 0.013696
[TensorRT] VERBOSE: >>>>>>>>>>>>>>> Chose Runner Type: TiledPooling Tactic: 6095105
[TensorRT] VERBOSE: 
[TensorRT] VERBOSE: *************** Autotuning format combination: Int8(1,8,64:32,128) -> Int8(1,4,16:32,32) ***************
[TensorRT] VERBOSE: --------------- Timing Runner: pool2 (Pooling)
[TensorRT] VERBOSE: Tactic: -4 time 0.00656
[TensorRT] VERBOSE: Fastest Tactic: -4 Time: 0.00656
[TensorRT] VERBOSE: --------------- Timing Runner: pool2 (TiledPooling)
[TensorRT] VERBOSE: TiledPooling has no valid tactics for this config, skipping
[TensorRT] VERBOSE: >>>>>>>>>>>>>>> Chose Runner Type: Pooling Tactic: -4
[TensorRT] VERBOSE: 
[TensorRT] VERBOSE: --------------- Timing Runner: <reformat> (Reformat)
[TensorRT] VERBOSE: Tactic: 1002 time 0.025856
[TensorRT] VERBOSE: Tactic: 0 time 0.00672
[TensorRT] VERBOSE: Fastest Tactic: 0 Time: 0.00672
[TensorRT] VERBOSE: --------------- Timing Runner: <reformat> (Reformat)
[TensorRT] VERBOSE: Tactic: 1002 time 0.020832
[TensorRT] VERBOSE: Tactic: 0 time 0.007008
[TensorRT] VERBOSE: Fastest Tactic: 0 Time: 0.007008
[TensorRT] VERBOSE: --------------- Timing Runner: <reformat> (Reformat)
[TensorRT] VERBOSE: Tactic: 1002 time 0.020448
[TensorRT] VERBOSE: Tactic: 0 time 0.008448
[TensorRT] VERBOSE: Fastest Tactic: 0 Time: 0.008448
[TensorRT] VERBOSE: --------------- Timing Runner: <reformat> (Reformat)
[TensorRT] VERBOSE: Tactic: 1002 time 0.026304
[TensorRT] VERBOSE: Tactic: 0 time 0.004928
[TensorRT] VERBOSE: Fastest Tactic: 0 Time: 0.004928
[TensorRT] VERBOSE: *************** Autotuning format combination: Float(1,4,16,800) -> Float(1,1,1,500) ***************
[TensorRT] VERBOSE: --------------- Timing Runner: ip1 + relu1 (CaskFullyConnected)
[TensorRT] VERBOSE: ip1 + relu1 (caskFullyConnectedFP32) Set Tactic Name: volta_sgemm_128x32_relu_nn_v1
[TensorRT] VERBOSE: Tactic: 8190451076631534509 time 0.098144
[TensorRT] VERBOSE: ip1 + relu1 (caskFullyConnectedFP32) Set Tactic Name: volta_sgemm_32x128_relu_nn_v1
[TensorRT] VERBOSE: Tactic: 5918215112415401770 time 0.112384
[TensorRT] VERBOSE: ip1 + relu1 (caskFullyConnectedFP32) Set Tactic Name: volta_sgemm_64x64_relu_nn_v1
[TensorRT] VERBOSE: Tactic: 3514307671120560729 time 0.125856
[TensorRT] VERBOSE: ip1 + relu1 (caskFullyConnectedFP32) Set Tactic Name: volta_sgemm_128x128_relu_nn_v1
[TensorRT] VERBOSE: Tactic: 3380542644225735979 time 0.211616
[TensorRT] VERBOSE: ip1 + relu1 (caskFullyConnectedFP32) Set Tactic Name: volta_sgemm_128x64_relu_nn_v1
[TensorRT] VERBOSE: Tactic: 2365066484941477695 time 0.121152
[TensorRT] VERBOSE: Fastest Tactic: 8190451076631534509 Time: 0.098144
[TensorRT] VERBOSE: --------------- Timing Runner: ip1 + relu1 (CudaFullyConnected)
[TensorRT] VERBOSE: Tactic: 0 time 0.10848
[TensorRT] VERBOSE: Tactic: 1 time 0.101408
[TensorRT] VERBOSE: Fastest Tactic: 1 Time: 0.101408
[TensorRT] VERBOSE: >>>>>>>>>>>>>>> Chose Runner Type: CaskFullyConnected Tactic: 8190451076631534509
[TensorRT] VERBOSE: ip1 + relu1 (caskFullyConnectedFP32) Set Tactic Name: volta_sgemm_128x32_relu_nn_v1
[TensorRT] VERBOSE: 
[TensorRT] VERBOSE: *************** Autotuning format combination: Int8(1,4,16:4,208) -> Int8(1,1,1:4,125) ***************
[TensorRT] VERBOSE: --------------- Timing Runner: ip1 + relu1 (CaskFullyConnected)
[TensorRT] VERBOSE: ip1 + relu1 (caskFullyConnectedFP32) Set Tactic Name: volta_int8_igemm_int8_128x128_ldg4_relu_nn_v0
[TensorRT] VERBOSE: Tactic: -8859072962406416919 time 0.06768
[TensorRT] VERBOSE: Fastest Tactic: -8859072962406416919 Time: 0.06768
[TensorRT] VERBOSE: --------------- Timing Runner: ip1 + relu1 (CudaFullyConnected)
[TensorRT] VERBOSE: CudaFullyConnected has no valid tactics for this config, skipping
[TensorRT] VERBOSE: >>>>>>>>>>>>>>> Chose Runner Type: CaskFullyConnected Tactic: -8859072962406416919
[TensorRT] VERBOSE: ip1 + relu1 (caskFullyConnectedFP32) Set Tactic Name: volta_int8_igemm_int8_128x128_ldg4_relu_nn_v0
[TensorRT] VERBOSE: 
[TensorRT] VERBOSE: --------------- Timing Runner: <reformat> (Reformat)
[TensorRT] VERBOSE: Tactic: 1002 time 0.01184
[TensorRT] VERBOSE: Tactic: 0 time 0.00512
[TensorRT] VERBOSE: Fastest Tactic: 0 Time: 0.00512
[TensorRT] VERBOSE: *************** Autotuning format combination: Float(1,1,1,500) -> Float(1,1,1,10) ***************
[TensorRT] VERBOSE: --------------- Timing Runner: ip2 (CaskFullyConnected)
[TensorRT] VERBOSE: ip2 (caskFullyConnectedFP32) Set Tactic Name: volta_sgemm_128x32_relu_nn_v1
[TensorRT] VERBOSE: Tactic: 8190451076631534509 time 0.039648
[TensorRT] VERBOSE: ip2 (caskFullyConnectedFP32) Set Tactic Name: volta_sgemm_32x128_relu_nn_v1
[TensorRT] VERBOSE: Tactic: 5918215112415401770 time 0.039232
[TensorRT] VERBOSE: ip2 (caskFullyConnectedFP32) Set Tactic Name: volta_sgemm_64x64_relu_nn_v1
[TensorRT] VERBOSE: Tactic: 3514307671120560729 time 0.076192
[TensorRT] VERBOSE: ip2 (caskFullyConnectedFP32) Set Tactic Name: volta_sgemm_128x128_relu_nn_v1
[TensorRT] VERBOSE: Tactic: 3380542644225735979 time 0.136928
[TensorRT] VERBOSE: ip2 (caskFullyConnectedFP32) Set Tactic Name: volta_sgemm_128x64_relu_nn_v1
[TensorRT] VERBOSE: Tactic: 2365066484941477695 time 0.075776
[TensorRT] VERBOSE: Fastest Tactic: 5918215112415401770 Time: 0.039232
[TensorRT] VERBOSE: --------------- Timing Runner: ip2 (CudaFullyConnected)
[TensorRT] VERBOSE: Tactic: 0 time 0.080928
[TensorRT] VERBOSE: Tactic: 1 time 0.079168
[TensorRT] VERBOSE: Fastest Tactic: 1 Time: 0.079168
[TensorRT] VERBOSE: >>>>>>>>>>>>>>> Chose Runner Type: CaskFullyConnected Tactic: 5918215112415401770
[TensorRT] VERBOSE: ip2 (caskFullyConnectedFP32) Set Tactic Name: volta_sgemm_32x128_relu_nn_v1
[TensorRT] VERBOSE: 
[TensorRT] VERBOSE: *************** Autotuning format combination: Float(1,1,1,10) -> Float(1,1,1,10) ***************
[TensorRT] VERBOSE: --------------- Timing Runner: prob (SoftMax)
[TensorRT] VERBOSE: Tactic: 1001 time 0.008416
[TensorRT] VERBOSE: Fastest Tactic: 1001 Time: 0.008416
[TensorRT] VERBOSE: >>>>>>>>>>>>>>> Chose Runner Type: SoftMax Tactic: 1001
[TensorRT] VERBOSE: 
[TensorRT] VERBOSE: Adding reformat layer: conv1 reformatted input 0 (data) from Float(1,28,784,784) to Int8(1,28,784:4,784)
[TensorRT] VERBOSE: Adding reformat layer: ip1 + relu1 reformatted input 0 (pool2) from Int8(1,4,16:32,32) to Int8(1,4,16:4,208)
[TensorRT] VERBOSE: Adding reformat layer: ip2 reformatted input 0 (ip1) from Int8(1,1,1:4,125) to Float(1,1,1,500)
[TensorRT] VERBOSE: Formats and tactics selection completed in 7.58862 seconds.
[TensorRT] VERBOSE: After reformat layers: 10 layers
[TensorRT] VERBOSE: Block size 1073741824
[TensorRT] VERBOSE: Block size 589824
[TensorRT] VERBOSE: Block size 147456
[TensorRT] VERBOSE: Total Activation Memory: 1074479104
[TensorRT] INFO: Detected 1 inputs and 1 output network tensors.
[TensorRT] VERBOSE: conv1 (icudnn) Set Tactic Name: volta_int8x4_icudnn_int8x4_128x32_relu_interior_c32_nn_v1
[TensorRT] VERBOSE: conv2 (i8816cudnn) Set Tactic Name: volta_int8_i8816cudnn_int8_256x64_ldg16_relu_singleBuffer_interior_nt_v1
[TensorRT] VERBOSE: ip1 + relu1 (caskFullyConnectedFP32) Set Tactic Name: volta_int8_igemm_int8_128x128_ldg4_relu_nn_v0
[TensorRT] VERBOSE: ip2 (caskFullyConnectedFP32) Set Tactic Name: volta_sgemm_32x128_relu_nn_v1
[TensorRT] VERBOSE: Engine generation completed in 10.0292 seconds.
[TensorRT] VERBOSE: Engine Layer Information:
[TensorRT] VERBOSE: Layer: conv1 input reformatter 0 (Reformat), Tactic: 0, data[Float(1,28,28)] -> conv1 reformatted input 0[Int8(1,28,28)]
[TensorRT] VERBOSE: Layer: conv1 (icudnn), Tactic: -4208188808979933945, conv1 reformatted input 0[Int8(1,28,28)] -> conv1[Int8(20,24,24)]
[TensorRT] VERBOSE: Layer: pool1 (Pooling), Tactic: -4, conv1[Int8(20,24,24)] -> pool1[Int8(20,12,12)]
[TensorRT] VERBOSE: Layer: conv2 (i8816cudnn), Tactic: -1383447415429797909, pool1[Int8(20,12,12)] -> conv2[Int8(50,8,8)]
[TensorRT] VERBOSE: Layer: pool2 (Pooling), Tactic: -4, conv2[Int8(50,8,8)] -> pool2[Int8(50,4,4)]
[TensorRT] VERBOSE: Layer: ip1 + relu1 input reformatter 0 (Reformat), Tactic: 0, pool2[Int8(50,4,4)] -> ip1 + relu1 reformatted input 0[Int8(50,4,4)]
[TensorRT] VERBOSE: Layer: ip1 + relu1 (caskFullyConnectedFP32), Tactic: -8859072962406416919, ip1 + relu1 reformatted input 0[Int8(50,4,4)] -> ip1[Int8(500,1,1)]
[TensorRT] VERBOSE: Layer: ip2 input reformatter 0 (Reformat), Tactic: 0, ip1[Int8(500,1,1)] -> ip2 reformatted input 0[Float(500,1,1)]
[TensorRT] VERBOSE: Layer: ip2 (caskFullyConnectedFP32), Tactic: 5918215112415401770, ip2 reformatted input 0[Float(500,1,1)] -> ip2[Float(10,1,1)]
[TensorRT] VERBOSE: Layer: prob (SoftMax), Tactic: 1001, ip2[Float(10,1,1)] -> prob[Float(10,1,1)]
Validating batch 10
Validating batch 20
Validating batch 30
Validating batch 40
Validating batch 50
Validating batch 60
Validating batch 70
Validating batch 80
Validating batch 90
Validating batch 100
Validating batch 110
Validating batch 120
Validating batch 130
Validating batch 140
Validating batch 150
Validating batch 160
Validating batch 170
Validating batch 180
Validating batch 190
Validating batch 200
Validating batch 210
Validating batch 220
Validating batch 230
Validating batch 240
Validating batch 250
Validating batch 260
Validating batch 270
Validating batch 280
Validating batch 290
Validating batch 300
Validating batch 310
Total Accuracy: 99.08%

